{
  "kind": "source-definition",
  "schemaVersion": "2.10.0",
  "id": "a07-db-alarm",
  "version": "1.0.0",
  "equipmentInstanceId": "line-a-motor-db",
  "connectionProfileRef": "logical-db",
  "accessProfileRef": "s7-300-db-v1",
  "status": "ready",
  "rawAddressText": "DB10.DBW40",
  "addressRadix": null,
  "access": {
    "kind": "db-offset",
    "dbNumber": 10,
    "byteOffset": 40,
    "byteLength": 2,
    "bitOffset": null
  },
  "rawRepresentation": {
    "mode": "bytes",
    "valueType": "UInt16",
    "byteOrder": "big",
    "wordOrder": "high-first"
  },
  "inputStage": "already-engineered",
  "unit": {
    "status": "not-applicable"
  },
  "evidenceRefs": [
    {
      "artifactId": "manual-a07-db-alarm",
      "locator": {
        "kind": "text-line",
        "line": 1
      }
    }
  ],
  "viewOf": {
    "id": "a07-db-word",
    "version": "1.0.0"
  },
  "sourceKind": "plc",
  "accessMode": "read",
  "view": {
    "kind": "bit",
    "bitIndex": 15
  }
}
